department,title,date,link,context
국어국문학과,인정학점 관련,2024.10.14,https://koreanlit.yonsei.ac.kr/korean/notice01.do?mode=view&articleNo=213205&article.offset=0&articleLimit=10,"연세대학교에서는 편입, 국내 및 국외 교환, 소속변경 학생을 대상으로 학점인정 제도를 운영하고 있습니다.이때 승인은 학과의 전공 과목 담당 교수님께 얻게 됩니다.*절차는 아래 사이트 참고https://www.yonsei.ac.kr/sc/support/college_admin11.jsp국어국문학과에서는 2025-1학기부터 학점인정 승인에 관하여 교과 내용의 유사점이 다수 있는 과목에 한하여만 학점인정을 하기로 결정했으며, 이전보다 학점인정 승인이 어려워졌습니다. 그렇기 때문에 학점인정 신청을 하여도 승인이 되지 않을 수도 있다는 점을 참고하여 주시기 바랍니다."
국어국문학과,[졸업] 제2외국어 의무 이수 면제 공인인증시험 성적 제출 기한,2024.09.24,https://koreanlit.yonsei.ac.kr/korean/notice01.do?mode=view&articleNo=211911&article.offset=0&articleLimit=10,2월 졸업예정자중 제2외국어를 2학기 이수하지 않은 학생은 이전 년도12월 15일까지8월 졸업예정자중제2외국어를 2학기 이수하지 않은 학생은 당해6월 15일까지의무 이수 면제를 위한 공인인증시험 성적을sckorean@yonsei.ac.kr로 제출해 주시기 바랍니다.성적 제출 시한은 교무처 학사지원팀의 일정에 따른 것으로 해당 학생들은 성적 제출 마감일을 잘 숙지하여 졸업에 차질이 없도록 준비해 주시기 바랍니다.* 국어국문학과 제2외국어 2학기 과목 및 의무 이수 면제 관련 내용은 학과 '졸업 요건' 참고 바람https://koreanlit.yonsei.ac.kr/korean/graduate/law01.do
국어국문학과,대학교양「정보와기술」영역 필수 이수 안내,2023.12.21,https://koreanlit.yonsei.ac.kr/korean/notice01.do?mode=view&articleNo=179766&article.offset=0&articleLimit=10,"2022학년도 입학자부터 대학교양 수업인 <정보와 기술> 영역 교과를 필수로 이수해야 졸업이 가능하도록 되었습니다.단, 문과 대학 공통 과목인 HUM2038 <디지털 언어 데이터와 인문학>, HUM2039 <인문학을 위한 코딩>은 대학 교양 <정보와 기술> 영역으로 교차 인정됩니다.(이 경우 교양으로 인정 받을 시, 전공으로 인정 받을 수 없으며 총 이수 학점에서 3학점만 인정됨)"
국어국문학과,국어국문학과 대학배정 장학생 지급 기준,2023.03.08,https://koreanlit.yonsei.ac.kr/korean/notice01.do?mode=view&articleNo=161362&article.offset=0&articleLimit=10,"<국어국문학과 대학배정 장학생 지급 기준>1. 대학배정장학생 공통 기준가. 해당학기재학생(학기초과자 제외)나.직전학기12학점 이상 이수,평량평균이2.5이상인 학생* 단, 특수교육대상자는 직전학기 평량평균이 2.0 이상인 학생(이수학점, 수업연한 제한 없음)다.학기당 수혜 받는 장학금 합계가 등록금을 초과할 수 없음(생활비, 교재비, 근로장학금 등은 합산 제외)2. 국어국문학과 대학배정장학생 추천 기준가. 진리장학금(성적)과 자유장학금(경제상황)의 지급 비율은 장학금 신청 현황에 따른다나. 외국인 학생에게 진리+자유 장학금 총액의 10% 정도를 배정한다.(이는 전체 재학생 중 외국인 학생 비율에 근거한 것이며, 외국인 학생 수의 증감에 따라 배정액을 조정한다.)다. 진리장학생-성적우수1) 추천기준 : (진리)장학금 신청자 중에서 고려하여 추천하는 것을 원칙으로 하며 추가로 이수학점을 고려한다.2) 성적이 동점자인 경우, 이수학점이 높은 순으로 추천함.3) 외국인 학생인 경우 18학점 이상 이수하고 성적 3.5 이상인 학생에게 학점을 고려하여 차등 지급한다.4) 지급금액은 장학금 배정금액 및 장학금 신청현황에 따라 변동 가능함성적금액비고4.302,000,000이수학점 18학점 이상4.301,500,000이수학점 18학점 미만4.301,000,000이수학점 15학점 미만4.25~4.291,000,000이수학점 18학점 이상"
국어국문학과,[학부] 지도교수,2023.01.10,https://koreanlit.yonsei.ac.kr/korean/notice01.do?mode=view&articleNo=157729&article.offset=0&articleLimit=10,연세대학교 국어국문학과(학부) 학번별 지도교수님을 알려드립니다.각 학번별 지도교수15학번 : 백문임16학번 : 유준17학번 : 조태린18학번 : 유현경19학번 : 박애경20학번 : 김현주21학번 : 유준22학번 : 박무영23학번 : 원미진24학번 : 유준학번별로 지도교수님이 다르오니 각종 추천서와 면담은 자신의 지도교수님께 신청해주시기 바랍니다.
국어국문학과,커리어연세 현장실습 교과목의 전공학점 승인 관련,2023.01.03,https://koreanlit.yonsei.ac.kr/korean/notice01.do?mode=view&articleNo=157310&article.offset=0&articleLimit=10,"<커리어연세 현장실습> 2024.10.14 수정https://intern.yonsei.ac.kr/위 사이트의 공지사항 필독1. 학생복지처 현장실습지원센터에서는 학부생의 직무 이해도를 향상시키고 진로 탐색의 기회를 제공하고자 커리어연세 현장실습 프로그램을 운영하고 있으며 본 프로그램은 대학혁신지원사업의 일환으로 운영되고 있습니다.2. 참가학생은 실습생의 지위로서 교육의 목적을 가지고 현장실습기관에서 업무를 경험하게 됩니다.학과 승인 여부에 따라 교과목의 전공학점이 인정 가능합니다.국어국문학과의 경우 전공학점으로3학점까지 인정이 가능합니다.3. 참고사항(기간 및 학점은 정규학기/계절학기 구분 필)가. 현장실습 기간: 정규학기 기간 / 계절학기 기간나. 수업으로서의 요건을 갖추기 위한 현장실습의 구성1) 실습기관의 현장실습 수업계획 수립: [붙임2] 실습기관 운영계획서2) 평가 방식 및 기준 설정: 아래 제출 서류를 종합적으로 검토하여 평가 진행가) 실습생 활동 보고서: 실습 중 주간보고서, 중간점검서 / 실습종료 후 결과보고서 및실습 수기 제출나) 현장실습 기관의 평가: 실습종료 후 출석부, 평가표를 제출다) 상기 제출자료를 종합검토 후 평가 및 학점부여3) 지도(담당)교수의 현장 방문 지도: 실습기간 동안 2회 방문* 학생복지처 현장실습지원센터 소속 산학협력중점 교수 담당다. 현장실습의 교과목 안내- 총 개설학점: 총 15학점(정규학기), 6학점(계절학기)- 성적 평가방식: P/NP평가정규학기실습기간인정학점(전공 또는 일반선택 학점으로 인정)16주15학점계절학기실습기간(최소 실습시간)인정학점(전공 또는 일반선택 학점으로 인정)8주(320시간 이상)6학점※커리어연세 현장실습 교과목의 전공학점 인정을 받고자 하는 학생은, 사전에 반드시 학과의 관련분야 지도교수님을 물색하고 선정하여 지도교수님의 승인 하에 전공학점 승인 요청을 하기 바랍니다.※ 정규학기와 계절학기의 조건 및 일정이 상이하므로 반드시https://intern.yonsei.ac.kr/의 공지사항을 참조하기 바랍니다."
국어국문학과,문과대생을 위한 창업특강,2024.10.31,https://koreanlit.yonsei.ac.kr/korean/notice01.do?mode=view&articleNo=214317&article.offset=0&articleLimit=10,
국어국문학과,2025학년도 1학기 재입학 전형 안내,2024.10.28,https://koreanlit.yonsei.ac.kr/korean/notice01.do?mode=view&articleNo=214028&article.offset=0&articleLimit=10,"1재입학 지원 자격대상미등록, 미복학, 성적불량(제적일로부터 2년 경과된 자), 학기초과, 자원퇴학 제적자2모집 단위교육학과, 체육교육학과 및 약학과를 제외한 전 학과 약간 명1) 폐지된 법학과 제적생의 경우 행정학과로의 재입학 신청 가능2) 의과대학, 치과대학, 간호대학 학생은 소속대학 행정팀에 신청 가능 여부를 확인하여야 함3전형 방법1) 1단계: 학사지원팀 심사2) 2단계: 대학별 심의위원회 심사(해당 대학·학과)3) 3단계: 재입학 심의위원회 심사※ 필요에 따라 학과에서 시험을 부과할 수 있음※ 위 심사과정에서 하나라도 불가(不可)이면 재입학이 허가되지 않음4제출 서류학사포탈시스템을 통해 청원서, 서약서, 학업계획서, 학적증명서 제출5전형 일정1) 접수 기간: 2024. 11. 25.(월) ~ 12. 6.(금) 오후 5시2) 접수처: 교무처 학사지원팀(학사포탈 시스템)3) 합격자 발표: 2024. 12. 27.(금)6유의사항1) 재입학 후 첫 학기는 반드시 등록하여야 하며, 일반휴학 할 수 없음2) 재입학 이전의 재학기간, 학사경고 등의 학적사항, 취득학점 및 성적을 통산함- 재입학 전 일반휴학을 모두 활용한 학생은 재입학 후 일반휴학 할 수 없음- 재학연한은 이전 이수학기를 포함하여 12학기(당초입학생 기준)이며 이를 초과하는 경우 학기초과로제적됨. 단, 학기초과로 제적되었던 학생이 재입학하는 경우 제적 전 이수학기를 포함하여최대 16학기(3학년 편입생은 최대 8학기)까지 재학할 수 있음.- 재입학 전 학사경고 사항은 유효하며 횟수를 누적 적용함. 따라서, 성적불량으로 제적되었던 학생이재입학하는 경우 학사경고 1회만 받아도 제적됨3) 재입학은 1회에 한하여 허용함(재입학 합격 후 포기 시 재입학을 다시 할 수 없음)4) 재입학 합격 후 학기 개강 전까지는 계절학기를 수강할 수 없음5) 재입학 후 소속변경 할 수 없음"
국어국문학과,제22회 연문인상 시상식_2024.11.05.(화),2024.10.25,https://koreanlit.yonsei.ac.kr/korean/notice01.do?mode=view&articleNo=213956&article.offset=0&articleLimit=10,"문과대학 동창회에서는 매년 우리 문과대학 동문들 중 자신의 분야에서 훌륭한 업적을 이루고 사회에 이바지함으로써우리 문과대학의 이름을 드높이신 분께 〈연문인상〉을 드리고 있습니다.올해 〈제22회 연문인상〉의 수상자는 다음과 같습니다.- 학술부문:최종철동문(연세대 영어영문학과 명예교수)- 문화예술부문:나희덕동문(시인, 서울과학기술대 문예창작학과 교수)- 사회공헌부문:김준진동문 (기업인)많은 분들께서 참석해주시어 자리를 빛내주시면 대단히 감사드리겠습니다.-일시:2024년 11월 5일화요일오후 6시- 장소: 연세대학교 위당관 6층 문과대학 100주년기념홀"
국어국문학과,[대외협력팀] 금융권 취업설명회 및 멘토링 행사 안내,2024.10.24,https://koreanlit.yonsei.ac.kr/korean/notice01.do?mode=view&articleNo=213911&article.offset=0&articleLimit=10,
국어국문학과,2024-2 학부 중간고사 시험유형 및 시험일정,2024.10.21,https://koreanlit.yonsei.ac.kr/korean/notice01.do?mode=view&articleNo=213577&article.offset=0&articleLimit=10,"과목명담당 교수시험 실시 여부시험유형시험 일정시험 장소한국어문학의이해김영희, 박애경, 남길임, 임유경미실시우리말연구의첫걸음남길임실시대면시험10.24(목)10:00~위당관211문학이란무엇인가한혜린실시대면시험10.24(목)13:00~14:00위당관B05한국고전문학의이해박무영실시오픈북10.22(화)13:00~10.24(목) 13:00UT세미나(현대사회의소비담화에대한비판적연구)심주희미실시(보고서 대체)UT세미나(일상생활속이중언어의이해)이정현미실시(보고서 대체)UT세미나(한국사회의언어문제1)정지훈미실시(보고서 대체)UT세미나(여성생활로읽는한국고전시가)고하영미실시(보고서 대체)UT세미나(유머의서사와연행전략)김시연미실시(보고서 대체)UT세미나(한글맞춤법상식다시생각해보기)김상민미실시(보고서 대체)UT세미나(시텍스트읽기)김창욱미실시(보고서 대체)현대사회와문학김수안미실시(보고서 대체)소설쓰기김선아미실시(과제 대체)현대시읽기홍성희미실시(과제 대체)전공한문(고전문학전공을위한한문)유정열실시대면시험10.22(화) 16:00-19:00한국고전비평김하라실시대면시험10.24(목) 13:00~위당관215영상문학론백문임미실시시조가사론박애경실시대면시험10.23(수) 12:00외솔관02국어형태론유현경미실시(과제 대체)국어음성학김종덕실시비대면시험10.25(금) 13:00~16:00사회언어학조태린, 유희재실시대면시험10.22(화) 12:00~12:50위당관210글쓰기의이론과실제정희모미실시(보고서 대체)국어논리및논술이원지실시대면시험10.25(금) 13:00~15:00외솔관02고전문학과공연예술배연형미실시(과제 대체)현대문학과문화오혜진미실시(과제 대체)중세국어자료강독서상규실시대면시험10.24(목) 12:00~백양관S111언어습득론원미진실시대면시험10.21(월) 11:00~위당관215한국신화의이해김영희미실시크리에이티브콘텐츠제작유시어도어준미실시(보고서 대체)남북한문학읽기임유경실시대면시험10.22(화) 13:00~14:30위당관210한국어문법교육론최수정실시대면시험10.22(화) 10:00~11:10백양관S509고전소설과판소리주형예미실시(과제 대체)한국어문학과콘텐츠허찬미실시(과제 대체)국어교재연구및지도법유혜령실시대면시험10.24(목) 15:00~16:50위당관211"
국어국문학과,2024학년도 2학기 학부 수강과목 철회 안내,2024.10.17,https://koreanlit.yonsei.ac.kr/korean/notice01.do?mode=view&articleNo=213405&article.offset=0&articleLimit=10,"1. 수강철회 기간:2024. 10. 28.(월) 09:00 ~ 10. 30.(수) 23:592. 수강철회 방법연세포탈서비스(학사정보시스템 → 학사행정 → 수업 → 수강철회신청)에서 학생이 직접 온라인으로 철회 신청3. 유의사항가. 수강과목 철회 후 다른 과목으로 대체 수강신청 할 수 없으며, 수강과목 철회 후에도 신청과목이 최소 1과목 이상이 되어야 함나. 철회한 과목은 성적평가에서 제외되며, 성적증명서에 기재되지 않음.다. 수강과목을 철회한 학생은 학칙 제43조2항에 의하여 학점초과 신청이나 우등생(최우등생, 우등생, 우수생) 및 최우등졸업생, 우등졸업생 대상에서 제외4. 수강철회 후 수강내역 확인 방법가. 학생: 학사정보시스템 → 학사행정 → 수업 → 수강신청내역나. 교수: 학사정보시스템 → 학사행정 → 수업 → 수강현황 → 수강내역조회(교수)"
국어국문학과,2025학년도 1학기 캠퍼스내 소속변경 전형 안내,2024.10.16,https://koreanlit.yonsei.ac.kr/korean/notice01.do?mode=view&articleNo=213341&article.offset=0&articleLimit=10,캠퍼스내 소속변경 원서 접수 후 지원자가 있는 경우 다음과 같은 일정으로 진행 예정입니다.캠퍼스태 소속변경을 원하시는 분께서는 첨부파일을 참고하여 신청하기 바랍니다.구분일정비고소속변경 지원서 접수10. 28.(월) ~ 11. 1.(금)소속대학(학과) 1차 심사11. 5.(화) ~ 11. 6(수)지원대학(학과) 서류심사11. 7.(목) ~ 11. 11(월)지원대학(학과)에서 서류심사 후 면접대상자 지정가능면접대상 발표11. 14.(목)지원대학(학과) 면접11. 19.(화)최종 합격자 발표11. 29.(금)감사합니다.
국어국문학과,2024학년도 2학기 학부 강의정보 공유 설문 실시,2024.10.10,https://koreanlit.yonsei.ac.kr/korean/notice01.do?mode=view&articleNo=212931&article.offset=0&articleLimit=10,"2024학년도 2학기 학부 강의정보 공유 설문을 학사포탈시스템을 통하여 실시합니다.가. 실시 일정1차(중간)2차(최종)설문기간2024. 10. 21.(월) ~ 11. 4.(월)2024. 12. 27.(금) ~ 2025. 1. 5.(일)기준기간2024. 10. 21.(월) ~ 10. 25.(금)중간고사2024. 12. 30.(월) ~ 2025. 1. 5.(일)성적확인 및 변경기간공개기간2024. 11. 7.(목)부터 공개2025. 1. 9.(목)부터 공개나. 실시방법: 학사포탈시스템(http://portal.yonsei.ac.kr)에 접속하여 수강 과목의 설문 응답 실시다. 유의사항: 설문 실시기간 이후에는 설문에 참여할 수 없음라. 설문 문항(대학 공통)구분문항 상세비고강의정보 설문(기본)만족도, 피드백, 도전, 학생몰입,변화와 성장, 비차별원칙, 영어강의 여부6대 핵심역량창조적상상력, 도전적 지식탐구, 융합적사고력, 소통과협업, 섬김과기여, 시민참여의식결과 산정 시 미포함수업 일정 준수휴강 및 보강 횟수"
국어국문학과,[24-2학기] 폭력예방교육 이수 안내,2024.09.20,https://koreanlit.yonsei.ac.kr/korean/notice01.do?mode=view&articleNo=211421&article.offset=0&articleLimit=10,"윤리인권위원회 성평등센터는 여성가족부와 교육부의‘모든 대학 구성원 연 1회 폭력예방교육 의무 이수’지침에 따라 폭력예방교육(성희롱 예방교육, 성매매 예방교육, 성폭력 예방교육,가정폭력 예방교육)을 실시하고 있습니다.가. 폭력예방교육 시행 근거법: 양성평등기본법 제 31조, 성매매방지 및 피해자 보호 등에 관한 법률 제5조, 성폭력방지 및 피해자 보호 등에 관한 법률 제5조, 가정폭력방지 및 피해자보호등에 관한 법률 제4조의3나. 의무 교육 기준- 교원 및 직원: 성폭력 예방교육, 성희롱 예방교육, 성매매 예방교육, 가정폭력 예방교육- 학생: 성폭력 예방교육, 가정폭력 예방교육정부는전임 교원 이수율 80% 미만, 교직원 이수율 75% 미만, 학생 이수율 50% 미만대학을부진기관으로 지정하고 있습니다. 우리 대학은 교원 폭력예방교육 이수율 관련 2018년(24.5%), 2019년(41.75%), 2020년(67%) 3년 연속 부진 기관으로 지정된 사실이 있습니다. 이에아래와 같이 귀 단과대학(대학원) 소속 교원과 학생이 폭력예방교육을 이수할 수 있도록 적극 협조를요청드립니다.학생 대상 폭력예방교육 이수 홍보 협조 요청2학기 학생 행사 중 성폭력 예방과 학생 폭력예방교육 이수율 증진을 위하여 '폭력예방교육참여 학생 단체 간식 지원 행사'를 시행하오니 홍보 협조를 요청 드립니다.1) 개요: 2학기 학생 행사 중 성폭력 예방 및 폭력예방교육 이수율 증진 목적 시행(~ 11/30)2) 대상:연구실, 학과, 학생회, 동아리 등 집합식 폭력예방교육 신청 학생 단체 대상간식 지원(대학원생은 일반대학원 연구실 우선 지원)3) 신청: 붙임의 신청서를 작성하여 성평등센터 이메일로 신청(genderedu@yonsei.ac.kr)런어스 온라인 폭력예방통합교육 이수 안내 (교원, 학생 공통)1) 런어스(https://ys.learnus.org) 사이트에 탑재된 폭력예방통합교육 이수 (붙임 안내문 참고)2) 타 대학 및 기관에서 폭력예방교육 이수 후, 수료증을 성평등센터 이메일(genderedu@yonsei.ac.kr) 제출시 확인 후 이수 처리 가능3) 학과 또는 단과대학 단위 공동체교육 신청: 대면 또는 실시간 비대면교육 시행 (문의: 내선 2137)"
국어국문학과,2024 연세대학교 창업지원단 서포터즈 4기 모집,2024.09.05,https://koreanlit.yonsei.ac.kr/korean/notice01.do?mode=view&articleNo=210345&article.offset=0&articleLimit=10,"창업지원단에서는 대학혁신지원사업의 일환으로 연세대학교 학부생을 대상으로 창업프로그램을 홍보하는 「2024 연세대학교 창업서포터즈 4기」를 모집합니다.가. 프로그램명: 2024 연세대학교 창업서포터즈 4기나. 모집대상: 신촌/국제 소속 재학생으로 홍보 활동과 창업에 관심이 있는 자다. 모집기간: ~ 2024.9.9.(월) 15시까지라. 활동기간: 2024.9.16.(월)~ 2025.1.31.(금) ▶ 약 4.5개월마. 모집인원: 8명바. 신청방법: 담당자 이메일 접수(hwajin@yonsei.ac.kr)사. 주요내용: 총 100만원 장학금 지원, 창업지원단 명의 서포터즈 위촉장 발급 등붙임  2024 연세대학교 창업서포터즈 모집 포스터 1부."
국어국문학과,[학부] 2024년 8월 졸업자 학위수여식 및 학위가운 대여 안내,2024.08.28,https://koreanlit.yonsei.ac.kr/korean/notice01.do?mode=view&articleNo=209642&article.offset=10&articleLimit=10,문과대학 졸업생 여러분! 졸업을 진심으로 축하드립니다.2024년도 8월 졸업생을 위한 학위수여식 및 학위가운 대여와 관련하여 다음과 같이 안내드립니다.1. 학위수여식가.  일시 : 2024년 8월 30일(금)  11시나. 장소 :  대강당2. 졸업 가운 및 학위모 대여·반납(학부에 한함. 대학원은 대학원 홈페이지 참조)가. 대상: 2024년 8월 졸업대상자나. 장소: 문과대학 외솔관 106호다. 기간: 2024.8.26.(월) ~2024.8.30.(금) _평일 09:30~16:30라. 대여 /반납 관련 유의 사항1) 학부 졸업생은 다음 3가지를 모두 완료해야 학위 가운 및 학위모 대여가 가능합니다.① 취업 통계 조사 응답(졸업 가운 배부 장소에서 QR코드로 접속하여 응답 가능)② 대여료 납부 후 출력한 납부 영수증 제시 _ 세탁 보관료 납부 붙임 파일 참조③ 도서(비) 미납자는 도서관에 미납 도서 및 연체료를 납부한 후 받은 도서(비) 완납 증명서 제시2) 신분증(학생증)과 쇼핑백 지참 부탁드립니다. 대리인이 오는 경우 졸업생의 신분증을 지참 해야 합니다.3) 학위 가운 미반납 시 각종 증명서 발급이 제한됩니다.3. 졸업 증서 수령가.  가운과 학위모를 외솔관106호로 반납 후 졸업 증서를 받으시기 바랍니다. (8월 26일(월)~8월30일(금) 16:30)나. 가운 및 학위모를 반납하지 않을 경우 각종 증명서 발급이 제한됩니다.다. 졸업 증서 수령 후에는 학위가운 대여가 불가합니다.라. 2024. 9.2.(월) 부터는 외솔관 101-1호 문과대학 행정팀 사무실에서 졸업증서를 배부합니다. (대학원생은 스팀슨관 2층)4. 문의처 :  문과대학 외솔관106호 (02-2123-2257) 혹은 국어국문학과 사무실 (02-2123-2265)
국어국문학과,[2024-2] 한국어 튜터링 프로그램 '외국인 튜티' 모집 안내,2024.08.26,https://koreanlit.yonsei.ac.kr/korean/notice01.do?mode=view&articleNo=209431&article.offset=10&articleLimit=10,한국어 튜터링 프로그램에서 외국인 튜티 학부생을 모집합니다.활동 기간: 2024.09.13(금) ~ 12.22(일)신청 기간: 2024.08.21(수) ~ 09.08(일)자세한 내용은 첨부파일 참고 바랍니다.
국어국문학과,2024학년도 2학기 졸업앨범 사진촬영 관련 안내,2024.08.21,https://koreanlit.yonsei.ac.kr/korean/notice01.do?mode=view&articleNo=209262&article.offset=10&articleLimit=10,"1. 일시:2024년 9월 5일(목) ~ 11일(수)※ 우천시 예비일: 9월 12일(목) ~ 13일(금)2. 장소: 학생회관 4층, 본관 앞(언더우드관 앞)3. 방식: 개별 예약 후 실내 프로필, 학사모 사진, 야외 프로필 촬영※ 학과 단체사진 촬영: 교육학과, 체육교육학과, 간호학과4. 대상자: 2024년 8월, 2025년 2월, 8월 졸업 예정인 학부생※ 2025년 2월에 발간되는 ‘2025년도졸업앨범’에 수록하는 촬영입니다."
국어국문학과,2024년 여름 단기 3주 2차 및 가을 정규 과정  한국어학당 학생과의 언어교환 프로그램,2024.08.07,https://koreanlit.yonsei.ac.kr/korean/notice01.do?mode=view&articleNo=208320&article.offset=10&articleLimit=10,"○ 대상 언어 : 영어, 중국어, 일본어, 기타어(영어․중국어․일본어 외)○ 언어교환 활동 기한(주 1회)1. 여름 단기 3주 2차 : 2024년 9월 6일(금) ~ 2024년 9월 24일(화)2. 가을 정규 과정 : 2024년 9월 23일(월) ~ 2024년 11월 20일(수)○ 신청 기간 : 2024년 8월 26일(월) ~ 2024년 8월 29일(목)- 두 과정 모두 위 신청 기간에만 신청 가능(과정 간 중복 신청 가능)○ 신청 방법 : 아래의 구글 링크 클릭https://forms.gle/kGdCrLNqk3FZeCpt6자세한 내용은 첨부파일 참고 부탁드립니다."
