department,title,date,link,context,images
도시공학과,[학부] [장학] 2024학년도 2학기 박정옥 장학생 신청 안내 [8/26(월) 17시 마감],24.08.26,https://urban.yonsei.ac.kr/urban/notice/notice.do?mode=view&articleNo=209443&article.offset=10&articleLimit=10,가. 선 발 인 원 : 공과대학 1명나. 선 발 기 준 :2024학년도 2학기 대학배정 장학금을 신청한 학생 중 가계곤란자(대학배정 미신청자는 신청 불가능)다. 장 학 금 액 : 등록금성 장학금 200만원(등록금 범위 내 중복 수혜 가능)라. 제 출 서 류 : ① 재학증명서 ② 성적증명서 ③ 학자금지원구간통지서 ④ 故박정옥 님에게 쓰는 감사 편지 ⑤ 그밖의 가계곤란을 증명할 수 있는 서류(선택)마. 제 출 처 : 공과대학 행정1팀(제1공학관 N601호) 장학 담당자 김한빈바. 제 출 기 한 : 2024년 8월 26일 월요일 17시까지(기한엄수)사. 문 의 처 : orion@yonsei.ac.kr / 02-2123-2734 / 김한빈,
도시공학과,[학부] [안내] 2024-2학기 졸업앨범 촬영 일정 안내,24.08.22,https://urban.yonsei.ac.kr/urban/notice/notice.do?mode=view&articleNo=209325&article.offset=10&articleLimit=10,"2024-2학기 졸업앨범 촬영 일정 안내☞ 예약하기 →SEVENCOLOR(http://sevencolor.co.kr/prepareReg.php)⊙ 2학기 촬영은 예약제로 진행합니다. (예약 없이 방문 시 대기 시간 길어질 수 있음.)⊙ 예약 시 핸드폰 번호를 꼭 입력해 주세요. (공지 시 사용)⊙ 예약 변경은 전날 15시까지 반영합니다. (당일 예약 변경은 촬영 시 반영 안 됨.)⊙ 우천 예보 시, 학교 및 세븐칼라 홈페이지 공지 확인해 주세요. (전날 15시 기준)⊙ 개인 사진만 촬영합니다. (아래 3개 학과만 단체 사진 촬영 )※ 교육학과, 체육교육학과, 간호학과 (일정표 확인)1. 대 상 자: 2024년 8월, 2025년 2월, 8월 졸업 예정인 학부생※ 2025년 2월에 발간되는 ‘2025년도졸업앨범’에 수록하는 촬영입니다.2. 기 간: 2024년 9월 5일(목) ~ 11일(수)3. 장 소- 실내 프로필 / 학사모 사진 : 학생회관 4층- 야외 프로필 : 본관 앞4. 내 용: 실내 프로필, 학사모, 야외 프로필 촬영 ▶ 개인 촬영 (단체 촬영 없음.)5. 준 비: 학생증, 졸업증명서(졸업생), 의상(정장 추천-와이셔츠, 넥타이), 편한 신발6. 유의 사항- 졸업앨범비 납부에 대해 홈페이지 공지를 확인해 주시기를 바랍니다.- 졸업앨범 외 개인 사진 구매 시 별도의 비용이 발생합니다.- 현장 상황에 따라 예약 시간으로부터 1시간 이상 소요될 수 있습니다.- 문의: 세븐칼라사진, ☎ 02-776-6666, (평일 9시 ~ 18시, 토·일 휴무)7. 촬영 일정날 짜장소/시간10:00 ~ 11:50점심13:00 ~ 16:509/5(목)실내(학관)야외(본관)개인 촬영 (예약)12:00~12:50개인 촬영 (예약)9/6(금)실내(학관)야외(본관)체육교육학과 개인촬영(단체촬영: 11:40)간호학과 단체촬영 13:00(개인촬영: 13:00 ~ 15:00)개인촬영(예약)교육학과 개인촬영(단체촬영: 11:30)9/9(월)~ 11(수)실내(학관)야외(본관)개인촬영 (예약)개인촬영 (예약)9/12(목)~ 13(금)실내(학관)야외(본관)우천 시 예비일 ( 우천으로 촬영일 변경 시 사용함 )< 졸업앨범비 납부 안내 >졸업앨범 구매를 희망하는 학생은 아래 계좌로 납부해 주시기 바랍니다.1. 납부 기간: 2024년 8월 20일(화) ~ 9월 3일(화)2. 졸업앨범비 :61,000원(육만 일천 원)3. 납부 방법가. 졸업앨범비 계좌 입금 : 국민은행 817201-04-147733 이진우(세븐칼라사진)나. 계좌 이체 시- ‘본인 성명+학번 뒤4자리 숫자(동명이인 확인을 위함)’필히 기입 요망※ 예시 : 홍길동, 2019123456 → 홍길동3456(미기입 및 부모님 성함으로 입금 시 입금 확인 불가)다. 현금인출기(ATM)에서 무통장 입금으로 입금하는 경우 입금 확인이 안 될 수 있으므로반드시 영수증을 보관하시기 바라며 가급적 계좌이체를 해주시기 바랍니다.라. 졸업앨범비 납부 후 세븐칼라사진으로 연락해 주시기 바랍니다.※ 1학기 앨범비 입금 후 입금 확인 문자를 못 받으신 분은 연락주시기 바랍니다.(학번 없이 이름만 입금 시 확인 불가)4. 기타가. 졸업앨범비 납부자에 한해 추후 온라인 사이트에서 사진 확인이 가능합니다.나. 문의처 : 세븐칼라사진, ☎ 02-776-6666 (평일 9:00 ~ 18:00, 토·일 휴무)",
도시공학과,[대학원] 대학원 2024년 8월 학위수여식 안내,24.08.20,https://urban.yonsei.ac.kr/urban/notice/notice.do?mode=view&articleNo=209067&article.offset=20&articleLimit=10,"연세대학교 대학원 2024년 8월 학위수여식 안내영예의 학위 취득을 진심으로 축하드립니다.- 학위수여식 일시 및 장소 : 2024. 8. 30(금) 오전 11 시, 대강당- 2024년 8월 학위취득 대상자 조회 / 석사학위가운대여 / 학위기 수령 등 자세한 사항은 첨부파일 참고해주세요.",
도시공학과,[학부] [안내] 2024년 8월 졸업자 학위수여식 및 학위가운 대여 안내,24.08.16,https://urban.yonsei.ac.kr/urban/notice/notice.do?mode=view&articleNo=208925&article.offset=20&articleLimit=10,,image\IYEylkuEgkrPppvRZnWr.png
도시공학과,[대학원] 2024학년도 2학기 학위논문 연구계획서 제출 및 논문심사 일정 안내,24.08.12,https://urban.yonsei.ac.kr/urban/notice/notice.do?mode=view&articleNo=208620&article.offset=20&articleLimit=10,"2024학년도 2학기 학위논문 연구계획서 제출 및 논문심사 일정 안내대학원 학칙 제7장 학위논문(학위논문에 관한 내규) 따라 연구계획서를 작성하여 주시고,체제검사를 지도교수에게 받은 후에 예비심사 및 본심사에 임하시기 바랍니다.학위논문연구계획서 제출 및 논문심사위원 등록은반드시 학생이 직접학사포털에 입력 및 저장해야합니다.1. 제출자격가. 직전학기(2024-1)까지 자격시험(외국어, 종합시험) 합격자에 한함.(단, 휴학생은 제출불가)나. 2024-2학기 수강신청을 포함하여 수료요건 충족이 가능한 자2. 학위논문 연구계획서 제출 절차- 학사포탈시스템(http://portal.yonsei.ac.kr) → 학사행정 → 졸업 → 학생 →'졸업심사유형지정' 메뉴 이동 → 졸업심사유형 '학위논문' 선택후 '신청' 클릭(필수) →연구계획서 제출→연구윤리준수서약서 동의(필수) → 연구계획서 입력 · 저장 → 연구계획서 학사포털 제출 → 지도교수 승인, 학과 승인 → 대학원 승인- 입력마감 : 2024. 9. 13(금)3. 심사위원 등록- 지도교수와 상의하여 포탈시스템→논문심사위원등록 메뉴에서 등록- 단, 24-2학기에 학위논문 연구계획서 제출한박사(통합)과정은지도교수만 입력4. 유의사항- 연구계획서 입력 시 “학위논문 연구윤리 준수서약서”에 동의하여야만 입력가능.- 연구지도는 연구계획서 승인학기부터 수강한 연구지도 수강내역이 졸업요건에 반영됩니다.- 2006-2학기 이후 박사과정 신입생은 영문으로 논문을 작성해야 함.- 박사 및 통합과정은 연구계획서를 제출한 다음학기에 논문 예 · 본심을 받을 수 있음.(학위논문에 관한 내규 제2조에 의해 박사과정은 2학기이상 논문지도를 받아야 함: 연구계획서의 포탈입력 및 승인받은 학기에는 심사를 받지 못하고, 그 다음학기에 논문심사를 진행하게 됨을 각별히 유의!).기타문의사항 02.2123.2890",
도시공학과,[대학원] 24-2학기「연구지도」교과목 수강신청 관련 안내,24.08.12,https://urban.yonsei.ac.kr/urban/notice/notice.do?mode=view&articleNo=208619&article.offset=20&articleLimit=10,"「연구지도」교과목 수강신청 관련 안내﻿가.「연구지도」교과목 일괄 수강신청1)대상_ 대학원에서 연구지도 과목 일괄 수강신청 처리: 석사, 박사, 통합중단 포함_진급학기 기준 4학기 이상 재학생: 통합_진급학기 기준 6학기 이상 재학생2)「연구지도」교과목 일괄 수강신청은 수강신청 기간 시작일(8월16일)기준으로3~4일전에 진행될 예정이며,이후에 복학 또는 재입학한 학생들에게는 적용되지 않음3)일괄 수강신청 처리 이후에복학하거나 재입학한 학생 중「연구지도」교과목수강이 필요한 경우,수강신청 기간 또는 수강신청 확인 및 변경기간에 반드시본인이 직접 수강신청 시스템을 통해 신청 해야 함.나.「연구지도」교과목 삭제 금지1)「연구지도」교과목은 학생이 수강내역에서 직접 삭제 불가2)「연구지도」교과목을 반드시 이수해야 하는 학생이 본인의 실수 또는 졸업요건 에 대한 사전지식 미비 등의 이유로 일괄 수강신청 처리가 완료된 상태에서「연 구지도」교과목을 삭제하여 요건 미충족으로 졸업을 하지 못하는 상황을 방지하 기 위함3)일괄 수강신청 처리가 완료된「연구지도」교과목을 삭제해야 할 불가피한 사유 가 있을 경우, 신청서 학과에 제출(단,삭제 사유가 타당하지 않을 경우 삭제 불가)다.복학생,재입학생,과정변경(통합중단)학생에 대한「연구지도」교과목 수강 안내구분확인사항복학복학한 학생 중 석∙박사4학기,통합6학기 이상 학생은연구지도 일괄 수강신청 대상에 포함되지 않을 수 있으니,반드시 본인의 수강내역에 연구지도 교과목이 신청되어 있는지 확인하고,신청되어 있지 않을 경우 직접 연구지도 과목을 수강신청해야 함.재입학2024학년도 2학기 재입학 허가자 중 석∙박사4학기,통합6학기 이상 학생들은수강신청 확인 및 변경기간(9월 4일~6일)에 반드시 본인이 직접 연구지도 과목을 수강신청해야 함.과정변경(통합중단)통합→석사 과정변경 대상자 중 통합중단4학기 이상학생들은반드시 연구지도1과목을 수강신청해야함.(일괄 수강신청 처리가 되어 있지 않을 경우,본인이 직접 수강신청)연구지도2과목 삭제가 필요한 경우,아래의 신청 오류자 처리 절차에 따라 진행할 것라.「연구지도」신청 오류자 처리1)연구지도 과목은 선입력과 수강신청만 가능하며,학생 본인이 수강과목 목록에서 삭제할 수 없음2)본인의 학위과정에 부합하는 연구지도 과목 이외의 다른 연구지도 과목을 신청하였을 경우,[붙임5]의 양식에 기재하여연구지도 삭제요청 양식을 8.21(수)까지 ie@yonsei.ac.kr 제출마.학∙석연계과정3학기 재학생 또는 학기단축 희망 학생의「연구지도」수강신청1)진급학기 기준 석사3학기,박사2학기 재학생 중 학위수여 요건을 충족한 경우 「연구지도」수강신청 가능2)학∙석연계과정3학기 재학생은 반드시 연구지도 과목 신청을 확인하시기바랍니다.※3학기 재학생은 선입력 대상에 포함되지 않으며,본인이 직접 연구지도 과목을 학사포탈을 통해 수강신청할 수 없으므로 반드시 신청서를 제출해야 처리가능3)[붙임4]의 수강신청서를 8.28(수)까지 ie@yonsei.ac.kr 제출4)관련 근거:대학원 학칙 제8조의④ 각 학위과정의 학생 중 학위수여 자격 요건 을 충족한 학생은 정규등록을 한 학기 단축할 수 있다.단,통합과정의 학생 및 석사학위 논문 대체실적을 통해 학위를 취득하고자 하는 자는 제외한다.",
도시공학과,[학부] [안내] 2024-2학기 학부 수강신청 안내,24.08.12,https://urban.yonsei.ac.kr/urban/notice/notice.do?mode=view&articleNo=208605&article.offset=20&articleLimit=10,"1. 2024학년도 2학기 학부 수강신청 일정 안내자세한 내용은 수강편람 조회(https://underwood1.yonsei.ac.kr/com/lgin/SsoCtr/initExtPageWork.do?link=handbList&locale=ko)에서 2024학년도 2학기 수강편람_240701배포용을 참고하시기 바랍니다.2. ""도시계획을위한표현기법(구:스마트한도시설계표현기법""을 1학년 외에 학년이 수강신청을 하고자 하는 경우,담당교수님께 이메일을 사전에 보내시어 수강여부를 확인하시기 바랍니다.",image\CoewrylktkeqJiVvUoYj.png
도시공학과,[학부] [안내] 도시공학과 졸업요건표 안내,24.08.12,https://urban.yonsei.ac.kr/urban/notice/notice.do?mode=view&articleNo=208604&article.offset=20&articleLimit=10,"학부 학생들의 졸업요건표를 공지합니다.내용과 관련한 문의사항은 학과 사무실로 연락주시기 바랍니다.* 학과 사무실 연락처: 02-2123-2890/ urban@yonsei.ac.kr- 졸업요건은 입학년도를 기준으로 기재되었습니다.표에 포함되지 않은 교과목의 인정여부는 학과 사무실에서 확인하시기 바랍니다.- 교과목명은 해당년도를 기준으로 기재되었습니다.교과목명이 다르더라도 학정번호가 같다면 동일 교과목이니, 참고하시기 바랍니다.- 졸업요건표를 꼭 확인하시고, 궁금한 내용 및 이수 여부 등의 문의가 있을 경우,학과 사무실로 전화 혹은 이메일 주시기 바랍니다.",
도시공학과,[학부] [장학] 2024년 동산장학회 장학생 선발 안내,24.08.08,https://urban.yonsei.ac.kr/urban/notice/notice.do?mode=view&articleNo=208389&article.offset=20&articleLimit=10,"2024년 동산장학회 장학생에 지원하고자 하는 학생은제출서류 원본을 공과대학 행정1팀(제1공학관 N601호 장학담당자 김한빈)으로 제출하기 바랍니다.* 최종추천 대상자는 공과대학에서 선발합니다.* 기타문의사항은 02-2123-2734로 문의하시기 바랍니다.- 제출기한: 2024년 8월 23일(금)- 선발대상: 공과대학 7명- 선발조건: 이공계 전공 새터민(북한 출생), 성적이 우수하고 생활 환경이 어려운 학생- 장학금액: 생활비성 장학금 8백만원(1년)- 제출서류: 장학생 지원서(사진첨부필수), 장학생 추천서, 재학증명서 및 성적증명서- 유의사항: 사진 촬영본 서류 제출 불가",
도시공학과,2024 International Conference of Asia Pacific Planning Societies (ICAPPS) 대학(원)생 도우미 모집 안내,24.08.07,https://urban.yonsei.ac.kr/urban/notice/notice.do?mode=view&articleNo=208341&article.offset=20&articleLimit=10,"2024 International Conference of Asia Pacific Planning Societies (ICAPPS)대학(원)생 도우미 모집 안내2024년 8월 22일(목)부터 8월 24일(토)까지 연세대학교 신촌캠퍼스에서 개최되는2024 International Conference of Asia Pacific Planning Societies (ICAPPS) 국제학술대회에서 도움을 줄 대학(원)생을 모집합니다.국제 학술대회 경험을 쌓고 다양한 사람들과 소통할 수 있는 기회를 제공하니 많은 지원 바랍니다.모집 일정 및 역할1. 2024년 8월 22일 (목요일)ﾷ업무(1) 국제 학술대회 참가자 대상 현장 등록 안내(2) 개회식 운영 보조ﾷ장소: 제4공학관, 학생회관, 백양누리 그랜드볼룸 (단, 상황에 따라 변경 가능성 有)ﾷ예상 시간: 오후 1시 - 오후 8시ﾷ모집 인원: 7명2. 2024년 8월 23일 (금요일)ﾷ업무(1) 국제 학술대회 참가자 대상 현장 등록 안내(2) 세션(Session) 발표 준비 보조 및 진행 보조(3) 개·폐회식 운영 보조ﾷ장소: 제4공학관, 백양누리 그랜드볼룸 (단, 상황에 따라 변경 가능성 有)ﾷ예상 시간: 오전 7시 30분 - 오후 8시ﾷ모집 인원: 21명3. 2024년 8월 24일 (토요일)ﾷ업무: 테크니컬 투어(Technical Tour) 진행 보조[코스 1] - 서울: 연세대학교 → 북촌한옥마을 → 청계천 → 서울역사박물관[코스 2] - 인천 송도: 연세대학교 → 한중문화관 → 인천도시역사관 → 센트럴파크ﾷ예상 시간: 오전 8시 - 오후 4시ﾷ모집 인원: 7명4. 급여 및 혜택ﾷ일당 10만 원ﾷ중식 제공5. 우대 사항ﾷ학술 연구에 관심이 많은 도시공학과 대학(원)생ﾷ영어를 사용하는 데 두려움이 없는 대학(원)생6. 선발결과 발표ﾷ2024년 8월 16일 금요일ﾷ선발된 분들께는 개별적으로 휴대폰으로 연락 드립니다.많은 관심과 지원 바랍니다.신청 링크:https://forms.gle/zR4YivdRTFTHzPVBA",
도시공학과,[학부] [안내][일정변경]도시공학종합설계 연구주제 제출 안내,24.08.06,https://urban.yonsei.ac.kr/urban/notice/notice.do?mode=view&articleNo=208294&article.offset=20&articleLimit=10,"도시공학종합설계 연구주제 제출 안내1. 4학년 학생은 도시공학종합설계 과목(3학점) 수강 신청 및 팀 구성2. 팀은 2인 1조로 구성함3. 팀 구성을 못 한 학생은 연구주제만 제출4. 지도교수님 배정: 학과 배정5. 연구주제 및 팀 구성원 명단은8월 27일(화)까지 이메일(urban@yonsei.ac.kr) 제출(*일정연기)팀 구성원학번학번성명성명연구주제희망지도교수※ 공적 사정으로 손봉수 교수님은 희망지도교수로 신청할 수 없습니다.6. 세부일정 안내- 2,3학년 희망 팀 제출: 9월 2일(월) ~ 9월 6일(금)(*일정변경)- 첫 수업:9월 6일(금) 오후 4시 제1공학관 S102호",
도시공학과,[학부] [장학] 2024학년도 2학기 정봉숙 장학생 선발 안내,24.08.05,https://urban.yonsei.ac.kr/urban/notice/notice.do?mode=view&articleNo=208241&article.offset=20&articleLimit=10,"게시글 내용게시글 내용1. 추천대학 및 인원: 공과대학 2명2. 추천대상: 경제적으로 형편이 어려운 정규학기 학부 재학생(휴학생, 학기초과자 제외)직전학기 12학점 이상 이수하고 평량평균 2.5이상인 학생3. 장학금액: 1,000,000원 (등록금 또는 생활비 지원 가능)*생활비 장학금으로 지급할 경우 10월 중간고사 기간에 지급 예정4. 제출서류가. 성적증명서나. 학자금 지원구간 통지서(2024학년도 2학기 기준)(한국장학재단 홈페이지 → 장학금(상단메뉴) → 증명서발급 → 지원구간 통지서발급)- 2학기 소득분위 산정이 안된경우 2024학년도 1학기 통지서- 국가장학금 미신청 한 경우 부모님 건강보험료납부확인서다. 재학증명서5. 제출기간:2024년 8월 14일까지 공과대학 행정1팀 장학 담당자(제1공학관 N601호 김한빈선생님)앞으로 원본 서류 제출.",
도시공학과,[학부] [장학] 2024학년도 2학기 김순전 장학생 선발 안내,24.08.05,https://urban.yonsei.ac.kr/urban/notice/notice.do?mode=view&articleNo=208239&article.offset=30&articleLimit=10,"1. 추천인원: 공과대학 2명2. 추천대상: 가계곤란자(직전학기 12학점 이상 이수, 평량평균 2.5 이상)3. 장학금액: 1인당 1,500,000원(등록금 지원 장학금으로 등록금 범위 내에서 중복수혜 가능)4. 제출서류가. 성적증명서나. 학자금 지원구간 통지서(2024학년도 2학기 기준)(한국장학재단 홈페이지 → 장학금(상단메뉴) → 증명서발급 → 지원구간 통지서발급)-2학기 소득분위 산정이 안된경우 2024학년도 1학기 통지서-국가장학금 미신청 한 경우 부모님 건강보험료납부확인서다. 재학증명서5. 제출기간:2024년 8월 14일까지 공과대학 행정1팀 장학 담당자(제1공학관 N601호 김한빈선생님)앞으로 원본 서류 제출.",
도시공학과,[학부] [장학] 2024학년도 2학기 「산운(山雲) 이병호 자유 장학금」 장학생 선발 안내,24.08.05,https://urban.yonsei.ac.kr/urban/notice/notice.do?mode=view&articleNo=208224&article.offset=30&articleLimit=10,"2024학년도 2학기 「산운(山雲) 이병호 자유 장학금」 장학생에 지원하고자 하는 학생은제출서류 원본을 공과대학 행정1팀(제1공학관 N601호 장학담당자 김한빈)으로 제출하기 바랍니다.* 제출기한 : 2024. 9. 2.(월) 낮 12시* 최종 추천 대상자는 공과대학에서 선발합니다.* 기타 문의사항은 02)2123-2734로 문의 바랍니다.1. 신청자격가. 경제적 어려움으로 인해 학비 마련이 어렵거나 학업 수행에 곤란을 겪고 있는 학생나. 대한민국 국적이며, 2024학년도 1학기를 포함하여 3개 학기 이상 수료한 학부 재학생(편입학생은 편입 후 3개 학기 이상 수료)다. 2024학년도 1학기 이수학점 15학점 이상, 평량평균 3.0/4.3 이상라. 제외 대상: 평점이 부여되지 않는 과목(P/NP 및 S/U 평가 과목)에서 NP나 U의 성적을 받은 자, 학기 초과자, 간호대학 진급자, 졸업예정자 복수전공 전형 합격자, 징계자2. 선발인원: 공과대학 2명3. 장학금액: 1인당 생활비성 장학금 700만원(타 장학금과 중복수혜 가능)4. 제출서(접수된 서류는 반환하지 않음.)가. 신청서 및 자기소개서 (첨부파일1)나. 대한민국 국적을 확인할 수 있는 신분증 사본(주민등록증, 운전면허증, 여권 등)다. 학과장 추천서 (첨부파일2)라. 재학증명서마. 성적증명서(2024학년도 1학기 포함)바. 소득분위 증빙서류사. [해당자에 한함] 본인 또는 부모의 기초생활수급자 또는 차상위계층 증명서- 증명서 발급자가 부모인 경우, 가족관계증명서 추가 제출아. [위 바, 사에 해당하지 않는 경우]1) 가족관계증명서2) 부/모의 최근 1년간 지방세 세목별 과세증명서 또는 재산세 납세증명서- ‘해당 사항 없음’의 경우에 ‘해당 사항 없음’이 기록된 상태로 발급, 제출할 것(민원포털 민원24나 각 지역 지방세 납부 사이트 확인)3) 부/모의 최근 1년간 소득 관련 증빙서류- 소득금액증명원- 소득이 없는 경우 사실 증명(세무서 발급)자. 선택 증빙서류(원하는 경우만 제출)1) 가계 곤란 증빙서류 (예: 파산증명서, 부채증명서, 직계가족의 장기입원확인증명서, 실직증명서 등)5. 장학생 의무 사항가. 이 장학 사업과 관련한 공식 행사(장학금 수여식 등)에 참석나. 사업 주관 부서가 제출을 요구하는 자료 등을 성실히 제출다. 자신의 학적상태 및 신변에 주요한 변동이 있는 경우, 사업 주관 부서에 신속하게 알림라. 그 외 사업 주관 부서의 요청에 적극 협조6. 특이사항가. 생활비성 장학금으로 타 장학금과 중복 수혜 가능함나. 「산운 이병호 진리/자유 장학금」 수혜 횟수는 총 4회로 제한함",
도시공학과,[대학원] 2024학년도 2학기 수강신청 안내,24.07.31,https://urban.yonsei.ac.kr/urban/notice/notice.do?mode=view&articleNo=208021&article.offset=30&articleLimit=10,"2024학년도 2학기 수강신청 안내2024학년도 2학기 일반대학원 수강신청과 관련하여 안내드리오니,대학원생 여러분은 아래 사항을 반드시 확인하여 주시기 바랍니다.▶ 수강신청 관련 업무는 모두 연세 포털서비스 시스템을 통하여 이루어지므로 반드시 정해진 기간 내에 본인이 직접 수강 신청하시기 바랍니다.첨부 수강신청 안내문에 기재된 학생의 학기는 진급학기를 의미합니다. (http://portal.yonsei.ac.kr)▶ 대학원 학칙 제 21조 2항 (학사경고)에 의거,매학기 재수강전 직전학기 성적 평균이2.0미만인 경우에는 학사경고를 받게 되고,학사경고 총 2회를 받을 경우에는 성적불량으로 제적됩니다.성적불량으로 제적된 자가 재입학 후 학사경고를 1회 받게 되면 성적불량으로 제적되어 재입학이 불가하오니, 수강신청 및 학점관리에 주의하여 주십시오.▶ 초과학기자(석사/박사 5학기 이상, 통합 7학기 이상)는 수강신청 학점수(일반수강, 청강, 학부보충과목 포함)에 따라 등록금이 가산됩니다.▶ 학생 개개인의 수강신청에 지장이 없도록첨부의 수강신청 안내문을 반드시 확인하여 주시기 바랍니다.1. 신입생 및 재학생 수강신청 기간(학부보충수강신청 포함) : 2024. 8. 16.(금) ∼ 8. 22.(목)※수강신청은 상기 수강신청 기간 중 매일 오전10:00부터23:59까지 가능합니다. (토요일과 일요일은 수강신청 불가)*수강신청 시스템 로그인은 상기 기간 중 오전 9:00부터 가능합니다.2. 복학생 수강신청차수복학신청기간수강신청1차7. 15.(월) 00:00 ~ 8. 15.(목) 23:598. 16.(금) ∼ 8. 22.(목)9. 4.(수) ∼ 9. 6.(금)2차8. 16.(금) 00:00 ~ 8. 27.(화) 23:593차8. 28.(수) 00:00 ~ 9. 3.(화) 23:593. 수강신청 확인 및 변경기간 (학부보충 수강신청 포함): 2024. 9. 4.(수) - 9. 6.(금)※수강신청 확인 및 변경은 상기 기간 중 오전10:00부터23:59까지 가능합니다. (로그인은 9:00부터 가능)",
